{
  "schemaVersion": 1,
  "id": "book-reader",
  "acceptanceResults": [
    {
      "id": "a1",
      "met": true,
      "evidence": "Verified in hooks/use-reading-content.ts (reads local chapter content via getBookChapterContent helper) and components/content-display.tsx."
    },
    {
      "id": "a2",
      "met": true,
      "evidence": "Verified in hooks/use-reading-navigation.ts (updateReadingChapter, nextReadingChapter, previousReadingChapter update books.store and trigger state changes)."
    },
    {
      "id": "a3",
      "met": true,
      "evidence": "Verified in app/reading/index.tsx (saving offset dynamically to useReadingStore and restoring it inside the webview using postMessage/injectJavaScript)."
    }
  ],
  "nextAction": null,
  "completion": {
    "verifiedAt": "2026-07-28T10:15:00Z",
    "completedAt": "2026-07-28T10:15:00Z",
    "cancellationSummary": null,
    "supersededBy": null
  }
}
