{
  "schemaVersion": 1,
  "id": "ai-reading",
  "acceptanceResults": [
    {
      "id": "a1",
      "met": true,
      "evidence": "Verified in services/ai-providers/openai.provider.ts (processContent constructs fetch requests with custom headers/extra bodies to copilot API endpoint)."
    },
    {
      "id": "a2",
      "met": true,
      "evidence": "Verified in hooks/use-reading-content.ts (loadChapter effect reacts to readingAIMode changes and gets appropriate content using getReadingContent service)."
    },
    {
      "id": "a3",
      "met": true,
      "evidence": "Verified in services/content-processor.ts (checks SQLite cache with dbService.getProcessedChapter, processes with AI on cache miss, and writes back using saveProcessedChapter) and services/database.service.ts."
    }
  ],
  "nextAction": null,
  "completion": {
    "verifiedAt": "2026-07-28T10:20:00Z",
    "completedAt": "2026-07-28T10:20:00Z",
    "cancellationSummary": null,
    "supersededBy": null
  }
}
