{
  "schemaVersion": 1,
  "id": "settings-management",
  "acceptanceResults": [
    {
      "id": "a1",
      "met": true,
      "evidence": "Verified in controllers/settings-schema.ts (DEFAULT_SETTINGS defines OPENAI_API_URL, OPENAI_MODEL, BOOKS_API_URL, PREFETCH_COUNT) and controllers/stores/settings.store.ts / typography.store.ts."
    },
    {
      "id": "a2",
      "met": true,
      "evidence": "Verified in controllers/mmkv.ts (MMKVStateStorage wrapper around MMKV instance) and persistent stores using MMKVStateStorage."
    },
    {
      "id": "a3",
      "met": true,
      "evidence": "Verified in controllers/settings-schema.ts (sanitizeSettings and migratePersistedSettings sanitize legacy keys like COPILOT_CUSTOM_HEADERS)."
    }
  ],
  "nextAction": null,
  "completion": {
    "verifiedAt": "2026-07-28T10:00:00Z",
    "completedAt": "2026-07-28T10:00:00Z",
    "cancellationSummary": null,
    "supersededBy": null
  }
}
